,Link,Title,Author,Author_Profile,Date_Time,Content
0,https://productnation.co/my/home-appliance/kitchen/8132/best-hand-mixer-reviews-malaysia/,Mix It Up with These 6 Top-Rated Hand Mixers,Haema,https://productnation.co/my/author/Haema/,2020-06-01 00:13:09,"['When you’re looking to make a fluffy omelette or a simple 3-ingredients cake, imagine the hassle of getting the bulky stand mixer out of the cabinet. With a hand mixer, it not only minimises storage space but is also much quicker to clean up.', 'Besides being much cheaper to purchase, you would definitely complete kitchen work faster, especially if the mixer is handy and easy to access. Here are the top hand mixers specially selected for you.', 'When choosing your trusted hand mixer, one of the most important aspects is to opt for an ergonomic design. It’s especially important for heavy users. The Phillips Hand Mixer HR1457 is designed to provide you with a comfortable, effortless grip and a quiet working motor. With powerful 5 speed settings and stainless steel strip beaters, you can conveniently use this hand mixer for long hours.', 'If you are on the lookout for a basic use hand mixer, the Russel Hobbs Desire Hand Mixer provides you with this mixing equipment that caters especially for simple kitchen needs. With 5-speed setting plus turbo function, this hand mixer is also attached with chrome beaters and dough hooks. Easy to use for cookie dough or cake batter mixing.', 'A popular Malaysian kitchen brand, the Panasonic MK-GH1 Hand Mixer is quite a retro choice, the most popular mixer in many households. The low power consumption and 5-speed function will be suitable for users who are new to learning the ropes of mixing and baking. You can quickly whip up batter without much hassle with this mixer.', 'The Kenwood HM520 Hand Mixer offers you a lightweight choice, it’s easy to carry and whisk the mixer according to your needs. With stainless steel twin beaters, this mixer is fashioned with 3-speed function and a pulse setting for a swift beating or mixing. The twin beaters are completely safe for your dishwasher, it comes with a grip clip for neat storage.', 'The KitchenAid 5KHM720 Hand Mixer is a professional kitchen helper, equipped with stainless steel turbo beaters, it effortlessly mixes the ingredients with lesser batter build-up. The 7-speed function allows you control while preparing the ingredients and enables you to create versatile dishes requiring high-speed mixing such as whipped cream. With its electronic mixing sensor, this mixer automatically adjusts the speed according to the resistance of the mixture.', 'Specifically fashioned for your home use, the Pensonic Hand Mixer PM-116 is a competent mixing machine for your kitchen. With 5 speed settings, it easily helps you with your various mixing or beating needs. The turbo-powered mixer is also light in weight and with a comfortable grip, suitable for mixing cookie and bread dough.']"
1,https://productnation.co/my/home-appliance/kitchen/6937/best-stand-mixer-reviews-malaysia/,Bake to Perfection with These Top 6 Stand Mixers,Haema,https://productnation.co/my/author/Haema/,2020-05-10 18:59:26,"['The stand mixer is a versatile kitchen equipment that is also your assistant for preparing the most basic cake recipe for high-skilled pastry making. Reliable with speed and power control, you can simply whip up baked goods without any mess or effort. A credible stand mixer will definitely make your baking easier. Here’s a range of the best stand mixers in Malaysia.', 'A durable kitchen aid for your dough mixing with a powerful motor system. Trio New Large Power Stand Mixer works wonders especially with producing varieties of breads and pastries. Optimizing on tilt-back lock, it provides easy access for mixture of ingredients.', 'This mixer efficiently kneads the stiffest dough, you will be able to work on any recipe of your interest. Noise-free for your long hours in the kitchen, your family will appreciate it too!', 'Catering for your home needs, you can simply add in all the required ingredients and mix your batter hands-free. The Kenwood HM680 Chefette Stand Mixer is a design precisely made for home bakers. Designed mainly for cake mixing, you can improve your baking skill with this mixer. The Chefette will assist you from mixing the simplest cake batter to controlled speed for creamy icing.', 'Commercially designed with sturdy and stable support, the KitchenAid Bowl-Lift Heavy Duty Stand Mixer works wonders in a professional kitchen. With ultimate speed and mixing control, repeated usage for a large batch of baked goods will not wear out this mixer. Effortlessly mix and prepare any variety of breads, cakes, biscuits or pastries of your choice with this mixer.', 'Your choice for a stand mixer on a budget, the Pensonic 5-Speed Stand Mixer is the basic mixing appliance for your kitchen. It is lightweight which allows comfort when handling it, and with the mini size it’s even suitable for your kids to work with you.', 'The swivel bowl and turbo power speed are suitable for all your mixing needs. Minimizing the space needed on your kitchen counter, you can now fresh cookies and cakes daily.', 'For all those freshly beginning baking enthusiasts, the Electrolux Stand Mixer EHSM3417 provides you with an easy-to-approach appliance. The stainless steel bowl and beaters are quick and easy to clean. Not to mention the 5-levels of adjustable speed leave you with no worries to keep this mixer under control.', 'This economical mixer gives you value for money and allows you to easily whip up batches of biscuits or prepare the perfect birthday cake for your family.']"
2,https://productnation.co/my/home-appliance/kitchen/27834/best-cheap-mixer-malaysia/,Cook and Bake Better with These 7 Best Cheap Mixers Not More Than RM150!,jannatul,https://productnation.co/my/author/jannatul/,2020-05-18 16:24:59,"[""It's no doubt that most Malaysians can cook their meals at home because of their love for food. Hence why owning the correct and good kind of kitchen appliance like a mixer is crucial. They can make food preparation and cooking pretty easy and fast."", ""Mixing ingredients especially for baking can be tedious and messy. With food mixers, they can save a lot of your time, plus you'll feel less tired at the end of the day. If not all, most mixers come with a set of beaters and hooks for multi-purpose usage. Therefore, it's easier when you want to make dough or any baking. Nevertheless, do check out some of these best quality but cheap mixers."", 'This Kenwood HM400 hand mixer comes with twin beaters that have five different speeds. It allows you to control the mixing process, while the automatic rotating bowl makes baking so much easier. On top of that, the twin dough kneaders can help you knead dough effortlessly.', 'Whether you are making cookies or savoury dishes, Kenwood’s HM520 hand mixer will make stirring and mixing hassle-free for you. It’s three mixing speed, and the pulsing feature with 280W power will make food preparation so much easier. This white beauty comes in a compact size so that you can easily store it without hassle.', 'This seven-speed hand mixer comes in white or black with stainless steel dough hooks and beaters. Its 180W motor has seven different speed settings to let you create a variety of mixture from bread dough to ice cream. The great thing about this hand mixer is that you can turn it into a stand mixer; you can use any bowls you like.', 'This Itata grinder is perfect for grounding meat and small food products. Food aside, you can also use it for your baking needs as well like grinding nuts, chocolate bars, and other solid condiments for your cake and pastries.', 'It comes with a super sharp blade, and its strong stirring power allows you to grind hard food fast to save time. The bowl can hold up to two litres of stuff so that you can make them in big batches.', ""Whether you are a professional or a home baker, this seven-speed cake mixer does come in handy. It comes with a pair of beaters and dough hooks, and a 2L stainless steel bowl for a big enough batch at a time. Besides, there's also a built-in cooling system that can expand the machine's life."", 'This mixer comes with a 3.4L bowl big enough for a load of food mixture. There is a spatula and two beaters and dough hooks, that lets you prepare cookie and bread dough as well. The turbo power burst feature mixes everything super fast, and the five-speed settings allow you different mixing requirements.', ""The aroma of freshly baked bread makes the morning better, and you can do that effortlessly with Tmishion bread dough mixer. This stylish mixer comes with a 1.8L stainless steel bowl and two pairs of beaters and dough hooks. There's also a built-in cooling and air passing system to make sure the mixer lives a long enough life."", 'More: 10 Cake Delivery Services That You Can Put Your Trust In']"
3,https://productnation.co/my/eats/food/27965/wedding-cake-chandelier-upside-down/,Remember That Wedding ‘Chandelier’ Cake? Now Check Out These 7 Extravagant Cakes!,Patrick Loh,https://productnation.co/my/author/patrick/,2020-02-27 11:55:15,"[""Credit: Image taken from the bride, Zahirah Macwilson's Instagram"", 'You’ve been to weddings where a garden of flowers hangs on the ceiling and seen one where clouds of smoke filled the floor (think, a heavenly wedding). Still, we doubt you’ve seen an upside-down, ‘chandelier’ wedding cake that hangs from the ceiling...because we haven’t, and this is definitely the cherry on the cake (pun intended).', 'Our favourite celebrity couple, Aiman Hakim Ridza and Zahirah Macwilson, had their wedding reception on 21 February with an extravagant, 8-tier wedding cake hanging high on the ceiling.', 'The ‘chandelier’ cake was then slowly lowered down, so the couple could cut the cake during the ceremony. Nope, not even a piece of cake or slobs of cream fell to the ground. They were very much intact.', 'Credit: Image taken from @mhdrzm90 on Twitter', ""So, what’s the science behind this? What’s going on up there? Keep calm, as we’ve got the answer for you. The cake is still very much the right side up, resting on a platform, like a plate, because the cake tier is designed like an upside-down Christmas tree. So the smallest cake rest on the bottom and the size increases gradually to the top. Thanks to @mhdrzm90 who solved the mystery on Twitter with the caption 'Thank Me Later'."", 'Credit: Image taken from theweddingscoop.com', 'The brains and talent behind this cake to remember goes to Lily & Lola Cakes, who are also responsible for Yuna’s gorgeous gold and white cake at her wedding with husband, Adam Sinclair. So if you ever need a cake for weddings, birthdays, anniversaries, or just for couch potato mode on Sundays, Lily & Lola Cakes can be your go-to bakery.', ""That aside, there were plenty of cake designers and talents out there who have made the most, over the top cakes. They are so extra that we don't even know if you should cut them to eat. Anyway, here are some for your enjoyment."", '1) LeNovelle Cake Castle', '', 'OTT cakes like these will definitely put your wedding on the map. But is anyone willing to cut even a tiny piece to eat? Nevertheless, your wedding will be the talk of the town with this cake.', '2) LeNovelle Cake House', ""Nope, this is not a house; the entire thing is a cake. How wonderful is this design? It looks like a house model you see in showrooms, except you can cut and eat this one. Although the baker is in Indonesia, perhaps you can look for a local baker to recreate something similar to this. For now, let's take some time to soak in the beautiful creation."", '3) Spring Bloom Cakes Shopping Bags', ""Another one from Spring Bloom Cakes and this time, it's for the shopping and fashion enthusiast. The creation is truly amazing as fondant is used to cover the soft and moist cake inside."", '4) Spring Bloom Cakes Rapunzel', ""Yes, this entire thing is a cake and it's perfect for Disney fans, both children and adults. It can be a gift, or for birthdays and anniversary parties."", '5) Lavish Cupcakes Pots and Kitchen Cake', 'This is probably the best cake to get for a chef or someone who enjoy cooking in general. The spatula, cooking accessories, pot and table cloth is made with fondant or sugar paste. Creative, huh?', '6) Lavish Cupcakes Sugar Rush Cake', 'Need something fun, colourful and sweet? Look no further than this sweetness-overload cake with lollipops and ice cream cones all over. it can be a birthday cake for the kids, or one for your quirky, adult friend.', '7) Jun and Us Flower Fondant Cake', ""Let's face it, fancy flowers and cakes are not as affordable as how they used to be back in the days. Not if you put both of them together like this flower cake. Made with fondant and real flowers, this cake comes in three flavours: Caramelized Cookies Buttercake, Oreo Chocolate Cake and Red Velvet Cake."", '8) Lily & Lola Cakes Naailah', ""A cake with a candle-lit lamp in the middle, why not? It would work as a great display at events where the lights are dim. If you're extra enough, use it for your candlelight dinner to create that romantic ambience."", 'Are you getting a little hungry looking at all these gorgeous, delicious cakes? Order yourself some via these cake delivery services in Malaysia. They deliver fast and are inexpensive. Some of them offer free delivery as well when you buy above a certain amount.', 'However, if you’re feeling a little more adventurous and inspired, make your own with these best cheap cake mixers that are below RM 150. Happy baking!', 'Whether you are making cookies or savoury dishes, Kenwood’s HM520 hand mixer will make stirring and mixing hassle-free for you. It’s three mixing speed, and the pulsing feature with 280W power will make food preparation so much easier. This white beauty comes in a compact size so that you can easily store it without hassle.', 'This mixer comes with a 3.4L bowl big enough for a load of food mixture. There are two beaters, dough hooks and a spatula, that lets you prepare cookie and bread dough as well. The turbo power burst feature mixes everything super fast, and the five-speed settings allow you different mixing requirements.']"
4,https://productnation.co/my/home-appliance/small/27865/best-budget-hand-blender-malaysia/,7 Best Budget Hand Blenders That Are Not More Than RM 150,kayshni,https://productnation.co/my/author/kayshni/,2019-11-25 17:12:31,"['With the rise in popularity of hand blenders, you can bid farewell to manual whisking with a wooden spoon for silky smooth soups, sauces, dips, and smoothies.  Hand blenders make food prepping more convenient as it does not require you to pour ingredients into a separate container; just immerse the hand blender into the blend. ', 'But that’s not all; most hand blenders come with a plethora of attachments so it can chop, grind, and mill just as well as how they blend. ', 'The hand mixer features either two or three mixing blades attached to it. Depending on its speed, the hand mixer can combine ingredients whether they’re wet or dry. These tools are a great addition to a baker’s arsenal as they can beat eggs, create icing, whip cream and combine batters with impressive results.', 'On the other hand, a hand blender is a long, cylindrical device that utilises several steel blades designed to mush things up. Its long body design allows it to be immersed into pots and bowls easily. ', 'A simple distinction between the two is that a hand blender turns things into liquid while a mixer will not liquefy anything.', 'Hand blenders are very versatile as you can use it for puree soups, prepare smoothies, and chop herbs and nuts as well. It can also be used to whip up ingredients but it does not incorporate enough air into the mixture as a mixer does. ', 'Want to give hand blenders a try? Save your time and some money with these best budget hand blenders.', 'The Philips Daily Collection Hand Blender HR1603/00 features a blending foot that utilises a specific triangular shape to create optimal flow with fast and consistent blending. Besides, it runs on a strong 500 W motor to power through sturdy ingredients. ', 'This blender also serves different purposes as it comes with a detachable chopper and a whisk. To top it off, maintenance is made easy with the 2-button release system to remove the blending bar for cleaning.', 'The Willsence 4-in-1 Hand Blender is just what you need to whip up smooth purees to make baby food. As the blender is made with stainless steel, it is completely safe for consumption for babies. ', 'Furthermore, the blade is covered by a housing that keeps splashing which helps to minimise mess. Also, if you’re constantly on-the-go then you’ll appreciate that the blending shaft, chopper, beaker, and whisk are all dishwasher-safe.', 'Equipped with 600 W of power, the SAMU GIKEN Multifunction Hand Blender can handle virtually any food item you throw at it. It features solid stainless steel blades which can prepare soups that are velvety in texture. Besides, its 8 variable speeds control will allow you to mash potatoes to achieve a smooth consistency while preventing the mash from turning into mush.', 'Whipping up a batch of homemade juices and smoothies has never been easier with the Kenwood Triblade HDP102WG. Its 600 W motor gives the blender the oomph it needs to blitz tough vegetables and fruits. ', 'This hand blender utilises three-angled blades to ensure that all ingredients are blended consistently without any chunky or lumpy bits in the blend. Plus, its turbo function may come in handy if you want to crush some ice into your concoction.', 'Into baking? The Panaletrik Multifunction Hand Blender comes with a wire-whisk attachment so you can incorporate air into ingredients like egg whites, cream, light cake mixtures or muffin batters. This blender features a stainless steel blade that’s powered by an 800 W motor to make any dessert and mixtures imaginable. To add another layer to the blender’s utility, it also includes a chopping bowl that can be used to effectively grind nuts.', 'The strong 600 W motor on this SOKANY Hand Blender helps in efficiently blasting the fat and lye into smaller droplets so that they can saponify sooner. Its bottom rim of the blending shaft does not have grooves on it which allow the soap batter to trace quickly and more evenly. Plus, the shaft is made of stainless steel so it will not corrode when exposed to strong alkalis during the soap making process.', 'Thanks to Russell Taylors’ Hand Blender Set 600W HB-6, you can skip the trip to your local barista and top your hot drinks with home-made frothed milk. ', 'This blender comes with a tall yet narrow jar to achieve sufficient froths without overfilling while the foam rises nice and evenly. It also features an ergonomic handle that allows you to comfortably raise and lower the hand blender to properly aerate the milk.']"
5,https://productnation.co/my/lifestyle/19404/best-wedding-gift-malaysia/,10 Wedding Gift Ideas Malaysian Newlyweds Will Approve Of,glysentte,https://productnation.co/my/author/glysentte/,2019-01-17 07:56:49,"['Clueless when it comes to gifts? Some people complain that buying wedding gifts is the hardest thing to do. Fret not as we hook you up with the best presents for your friends and family. To splurge or not, it’s up to you.', 'If you are a bridesmaid and looking for a gift box for your friend and her spouse, get this one. Inside the gift box, there is a cotton towel, jasmine and mint scented diffuser as well as a pair of Eiffel Tower Coasters. It even comes with a greeting card inside so you don’t need to get one separately. Hooray, the perfect gift in one box.', 'Many people prefer a slow juicer to an old-fashioned blender, as this way, the fruits retain its vitamins and natural nutrients which is healthier for the body. A new bride needs one of this to maintain a healthy body and to detox from the food and drinks that she had during her wedding night.', 'You don’t need to get your friends expensive wedding gifts if you can’t afford it. Towels are one of the most affordable gifts for a wedding. 100% cotton and super water absorbent are the qualities that we look for in towels. How about that for a gift that doesn’t break the bank? It’s the thought that counts.', 'Why bother whipping and mixing your dough by hand when you can get a Khind Mixer? Get the bride a mixer as a wedding gift, so she doesn’t have to get her hands dirty. The mixer comes with a five-speed setting, perfect for both a beginner and an avid baker.', 'The easiest wedding gift to pick out for a best friend and a sister is lingerie. Oh, why? Because we already know their size, and we know they need lingerie for their honeymoon. We as best friends and sisters need to make sure they look good on their first night because the more skin they show, the better.', 'What a better way to show love than with time? Engrave your parents’ names on both the watches and show your timeless love by gifting both of them this set of couple’s watches. It will make the sleekest gift ever, and it will always be their thing, now and forever, just like their vows to one another.', 'This is the ultimate gift for watch connoisseurs. This six-slot display storage box is the perfect throne for their precious babies. Their watches are free from scratches and dust, just the way they like it. With this PU leather case, they will be able to display their watches while minimising the risk of damage.', 'Did you know that a glass shape does affect the flavour of wine? Enhance your favourite couple’s wine tasting experience by giving them a set of crystal glass for their wedding - best for Cabernet Sauvignon but is also suitable for other wines as well. Take one sip and voila, a taste of heaven.', 'A brother’s best friends are his siblings, and who knows him better than them? If your brother is a busy man, get him this shaver, as it will save him a lot of time in the morning, and night, with its wet and dry feature. He can even carry it in his bag and shave in the car before work if he’s adventurous enough.']"
6,https://productnation.co/my/home-appliance/small/11148/best-immersion-handheld-blender-malaysia/,Prepare Smoothies In a Jiffy With These 8 Handheld Blenders,Haema,https://productnation.co/my/author/Haema/,2019-08-01 11:47:30,"['A versatile kitchen gadget, the immersion blender is possibly the coolest tech in the wide range of cooking appliances. From velvet silk smoothies to a pureed soup, handheld blenders do wonders for you. What’s more, it’s portable and easy to store. Here are our top picks for amazing handheld blenders.', 'The Russell Taylors Multifunctional Hand Blender is the perfect kitchen helper for mothers. The sharp blades and multiple speed settings present you wonderfully amazing baby food with a smooth and silky consistency. Avoid accidental chunks in your child’s meal. You can even blend those unwanted veggies in the soup for fussy kids.', 'Joining the ranks of expert kitchen appliances, the KitchenAid Hand Blender is a must-have helper for a professional cook. Designed with a Removable 8” Blending Arm with Fixed Blade, you can certainly prepare an array of gastronomical delights without any hassle. From the smooth blending of milkshakes to soups or a quick buzz for salads and salsas, the S-shaped blade would blend the ingredients skilfully.', 'The Braun Soup Hand Blender features the PowerBell technology which blends finely and evenly. The ultra-hard stainless-steel blades ensure fast and efficient blending, reducing the suction. With the floral-bell shaped blades, you can blend soups and hummus thoroughly – no large unblended chunks. Prepare icy cold smoothies with frozen fruits competently mashed up by this proficient immersion blender.', 'From homemade sauces to fruit smoothies, the HG Double Speed Mini Hand Blender is an expert in blending. With a quick release detachable base, cleaning is made easy. It is very comfortable to use with a  one-speed setting, suitable for all kinds of meal preparation. It may be mini in size, but it gets the job done!', 'More: 8 Personal Blenders You Can Make Your Favorite Smoothies With', 'The notable brand Panasonic delivers the Handheld Immersion Blender high in performance with multiple functions. Equipped with a Four-Blade cutting system, you can whip up eggs in a matter of minutes with comfort to make delectable meringues. Immerse the blender into the egg whites and blend them till they form stiff glossy peaks, perfect for your pastry making. Blending smoothies is also no problem with this immersion blender.', 'Without burning a hole in your pocket, you can purchase a high-quality hand blender to prepare everything from soup to smoothies. The Philips Promix Hand Blender features a strong and durable motor to create perfectly smooth soup to shakes. With a slim grip and triangular-shaped discs, you can conveniently optimise the blending for all your culinary needs.', 'Durable and made for heavy-duty usage, the Breville Control Grip Stick Mixer is a trustworthy aid for your kitchen exploits. Select your speed and efficiently manage the texture from fine or medium to coarse for your soups, guacamole, and smoothies. This handheld blender also comes with a blade guard to prevent scratches on your kitchenware.', 'With this versatile handheld blender, you can manoeuvre through your food preparation effortlessly. It offers you an immersion blender which is lightweight and ergonomically designed for your cooking comfort. One press of a button and your home-cooked meal will look like professional gourmet cuisine with ease.  ']"
