,Link,Title,Author,Author_Profile,Date_Time,Content
7,https://productnation.co/my/home/kitchen-dining/16535/best-kuih-raya-baking-utensils-malaysia/,Make Raya Biscuits Like a Pro with these 10 Baking Utensils,ilianasreen,https://productnation.co/my/author/ilia/,2020-05-27 12:58:26,"['Is it even Hari Raya without some Tart Nanas, Samperit, Bahulu and other cookies? Let’s make it a remarkable Hari Raya by making your own Kuih Raya from scratch! You definitely don’t want to miss out on these important appliances and tools for baking your kuih.', ""Garnishing your cake and pastry with sugar icing can be a very messy process. Save yourself the trouble of cleaning up with this sifter. Besides, it's also a great way to remove clumps and debris from flour. "", 'More: Bake to Perfection with These Top 6 Stand Mixers', ""This adjustable rolling pin makes it easier for you to roll out the dough of cookies, pie crusts and pizza to a uniform thickness. It's much more hygienic as it will not absorb colours, odours or flavours. Furthermore, you don't even need to crowd your kitchen cabinets with rolling pins of different shapes and sizes. Additionally, the rolling pin's spacer will be not split or crack after many uses under heat and water."", 'Let’s go way back to when our grandmothers would make bahulu on their own to serve the guests because anything freshly made is always the best choice. This bahulu mould is one of the traditional tools used to make kuih Raya back in the day. It’s durable and easy to wash, so you have no excuses not to make bahulu every year!', 'Who here agrees that mixing and whipping your cookie batter is a form of a workout? Let’s skip all that, especially while you’re fasting, by using this mixer by Khind with a 5-speed setting for making dough, beating eggs and mixing to increase the production of your cookies. With this, all your guests can enjoy your home baked goods.', 'I bet no one can recall any house that doesn’t serve pineapple tart. Why don’t make your very own Tart Nanas specially baked from the heart to all your guests on Hari Raya? This durable mould can help you to make a perfectly shaped tart to serve this festive occasion.', 'More: Measure Your Ingredients Precisely with These 8 Digital Kitchen Scales', 'This measuring spoon set helps you measure small amounts of ingredients precisely – you don’t have to eyeball it anymore. It comes in a set of six with measurements ranging from half a teaspoon to one cup. Additionally, the cheerful assortment of colours is also sure to brighten up your kitchen!', 'The heart of cooking is putting in the correct amount of ingredients. The easy way to never go wrong is by measuring your own ingredients according to the recipe. This electronic kitchen scale comes with a bowl for you to weigh the ingredients needed. Plus, digital numbers are easier to be read compared to analogue scale, yes?', 'More: Conveniently Toast and Grill with These 7 Toaster Ovens', 'If you are aiming to make some samperit this Hari Raya, we’ve got just the thing for you. This is the Holy Grail product for achieving that perfect samperit shape. Making Raya biscuits have never been this easy!', 'Pouring batter into cupcake paper holders can get messy, and the clean up is tedious. Thankfully, this batter dispenser jug will make your job easier; loading your mixture will be a breeze. Besides, you can even add small berries and chocolate chips to your jug for dispensing.', 'Well, of course, an oven is the most important tool to make it all happen. This oven by Trio has an extra-large capacity so that more cookies can be baked at one time. Even when Raya season is over, it still can be used to prepare other food such as pizza and steak because it’s able to bake, grill, cook, and roast!', 'More: 13 Mouthwatering Raya Biscuits and Kuih You Can Buy Online']"
8,https://productnation.co/my/tech/gadgets/22804/best-external-sound-card-malaysia/,8 External Sound Cards for the Most Immersive Audio Experience,lirong,https://productnation.co/my/author/lirong/,2019-01-11 09:12:49,"['Most personal computers these days are multimedia ready with their sound capabilities already built in. This might lead you to ask what the purpose of a sound card is then.', 'A sound card can help to upgrade and enhance the sonic capabilities of your computer. It can also repair any audio problems that might be found in your computer. In fact, a good sound card allows you to fully experience activities such as games and movies on your computer. It also allows professionals to input sounds to be edited.', 'Check out some of the top external sound cards available in the Malaysian market below:', 'K-Mic’s external USB sound card works with all versions of Windows from 98SE and up. Users just need to plug in and let Windows install the appropriate drivers. This card is also compatible with your computer’s Bluetooth to stream audio to any speaker or headphone and provides high-quality audio for your computer.', 'The Alesis IO4 is a four channel USB device equipped for both Mac and PC users. Users of the IO4 can record and monitor four channels in 16-bit mode or two channels in 24-bit mode. The audio mixer can be controlled via physical controls on the unit or within the software interface.', 'Apart from the four analogue and digital input and output connections, the IO4 also comes with MIDI input and output ports for direct connection to MIDI-compatible instruments. As a sound card targeted at professionals, it also comes with a comprehensive sound editing suite a copy of the Steinberg Cubase Digital Audio Workstation (DAW) - one of the best and most popular DAW for composing, editing, recording and mixing audio.', 'The IO4 truly turns your computer into a mobile recording studio.', 'The SB1140 is Creative’s lower-end external USB 2,0 Sound Blaster. It is aimed at general computer users more than gamers. While it can still be used to enhance the audio from your games, using it to listen to music is what this sound card is best for.', 'The output from this 7.1 HD 24-bit/192 kHz, 120dB device is tailor-made to allow you to enjoy high fidelity music regardless of the genre from metal to classical. Simply tweak the sound settings on the Creative software mixer to suit your needs!', 'The Xonar U5 is a compact 5.1 channel surround sound USB external sound card. It provides 192 khz/24 bit HD sounds and utilises C-Media’s CM6631A Sound Processor to provide clear and detailed audio for gaming, music listening, movies or even DJing.', ""The sound card features an independent mic, master volume controls for instant audio adjustments, and integrated amplifiers for better audio performance. There's also Sonic Studio software included, and it works with Windows 7 and above."", 'The XONAR U7 MKII is one of Asus’ best external USB 2.0 sound cards available today. It features true 7.1 channel, 192kHZ/24 bit HD surround sound capabilities, and utilises a C-Media 6632AX HD Sound Processor.', 'This sound card also allows users instant audio adjustments to enhance both game and media playback experience. This can be achieved through the earphone and microphone volume controls, as well as the clickable controls between earphones and speakers.', 'It also comes with the Sonic Studio Software for sound editing and Sonic Radar Pro for mapping opponent’s locations in FPS games. The connection can be secured via analogue jacks, RCA, line in and digital inputs. Compatible with both Windows 7 and Mac OS X.', 'CLiPtec’s U-Sound BMA230 is a simple to use USB Virtual 7.1 Channel sound card. It has been designed to provide 7.1 channel and 3D sound capabilities to your computer. To use, just plug-and-play; no drivers are required at all. Once plugged in, connect a microphone to enjoy karaoke in 7.1 channel sound. This device works with all versions of Windows from Windows ME onwards.', 'Creative’s Sound Blaster is the generic driver for sound cards around the globe. Their latest offering - the pocket-sized BlasterX G5 is a USB 2.0/3.0 device. The 7.1 HD 24-bit/192kHz, 120dB audio soundcard is targeted squarely at the gaming industry and is designed to work on both Windows or MAC OS-based computers. It is also compatible with the Sony PS4 console.', 'The G5 has several connectivity methods and also comes with a recording software, despite its primary target audience being gamers.', 'Although Steel Sound is a newcomer in the sound card scene, their budget-priced 5Hv2 is raising some eyebrows. The USB 2.0 compatible card is equipped with a 16-bit ADC mic input and line in and can sample sounds at 1.48K/44.1 KHz.', 'The 5Hv2 also supports Xear3D, DS3D and EAX2.0 and provides true 7.1 Channel sounds. While this card is not compatible with Linux or Mac OS, it works perfectly for Windows users from Windows 98 onwards.']"
9,https://productnation.co/my/tech/gadgets/8072/best-laptop-desk-stand-malaysia/,Use Your Lappy in Comfort with these 8 Laptop Stands,Aaron,https://productnation.co/my/author/aaron/,2019-01-29 08:17:58,"['Why settle for a measly desk to place your laptop on when you can go for a laptop stand? As such, you’ll get the most out of your work when you use one. Here’s a list of the best laptop stands that should be on your shopping cart.', ""This multi-functional laptop stand is large enough to house your 17-inch notebook, allowing you to turn your table, couch, and even your bed into your workstation. Made with aluminium, it’s lightweight, durable and corrosion-resistant, hence the portability and not to mention, it's long-lasting as well."", ""Looking for a laptop stand that's the epitome of portability? Well, look no further than the Xgear A8 stand. It's light and compact; you can slide it into a laptop bag and always have it by your side. Plus, with the mouse pad, pen holder and cup platform, owning this laptop stand will make things so easy for you."", 'Made and designed in Indonesia, this adjustable laptop stand is the best if you wish to bring it to your office. It has a mouse pad feature, so you can effortlessly glide your mouse on it to jumpstart a productive day at work. Also, you can bid farewell to your non-adjustable office desk when you have this baby at hand.', 'Sitting in front of the PC all day might give you back pain and neck pain, DiiZiGN Laptop Stand Model N is here to save the day. It’s ergonomically designed to tilt at an angle of 18 degrees, which promotes right seating posture. So, prepare to say hasta la vista to body pain.', 'Besides, you can easily mount your smartphone and have it side-by-side with your laptop. Pretty sweet, huh? The surface of the laptop stand is topped off with an anti-slip rubbery design which prevents your laptop from shaking and falling off the stand.', 'From the ""Middle Kingdom"" comes this simple laptop stand. Made from aluminium alloy, this stand is both sturdy and strong enough to handle the weight of any laptop you place on it. Equipped with three knobs, you can adjust both angle and height however you want them to be – making it ideal for bed-use.', 'With USB fans in its arsenal, this laptop stand can cool your laptop down effectively and efficiently. The additional ventilation holes on the stand will surely dissipate heat quicker than you can say, “Hooray”!', ""Would love to own a laptop stand but money is an issue? Well, you won’t have to go broke with this laptop stand that's produced from ABS material that's robust and sturdy in construction. It has a longer lifespan compared to other laptop stands, plus you can also fold it in half like paper for easier storing."", 'An innovative computer like the MacBook Pro must be paired with an equally innovative laptop stand. What makes it innovative is the two auto-lock buttons on each side for height adjustment and two clamps for angle adjustment. Besides the MacBook Pro, it can also house large gaming notebooks and still have enough room to spare for a gaming mouse.', ""A laptop stand that's fit for a DJ must be able to securely house a laptop, mixer and other DJ equipment and the Pyle PLPTS55 fits the description. Equipped with a 4-prong anti-slip tray, this stand can securely hold your laptop, turntables and mixer without budging, so you can worry less about your equipment and focus more on DJ-ing."", ""You can place all your essentials in one place and gain access to all of them whenever you want with the additional two shelves and dual-arms. It's light and foldable and comes with a carrying case - easy for a DJ to bring it from one show to another.""]"
10,https://productnation.co/my/home/kitchen-dining/25252/best-meat-grinder-malaysia/,Grind Like a Butcher With These 7 Best Meat Grinders,lirong,https://productnation.co/my/author/lirong/,2019-01-03 08:12:02,"['A meat grinder helps to speed up the job of mincing meats whether for home or business. As such, there are many different kinds of meat grinders out there. They all differ in terms of power, efficiency, reliability, shape and volume.', 'Choosing the right one for you can be confusing. No worries; below are some of the best available options to fit your cooking needs.', 'This low-cost solution is perfect for those who don’t have large volumes of meat to grind but still want the convenience of an automated electric powered meat grinder. The 3-litre capacity grinds enough meat for 2 people. As opposed to the traditional hopper fed meat grinder, this multifunction grinder works like a normal food processor.', 'It also has stainless steel dual blades to shred the meat to the required consistency. While there’s no timer, the grinding vessel is transparent, so you can easily see when to turn the machine off. The versatile grinder can also be used to mince other items such as fruits and vegetables.', 'With a powerful 300W motor and compact traditional build, this meat grinder can work on 1kg of minced meat per minute, ideal for medium volumes of continuous grinding. You can be assured of its capability to grind well thanks to the stainless-steel blades. The grinder is made of food grade aluminium, industry grade ABS, and powdered metal.', 'If you’ve got bones to grind, you can easily do it with the Panasonic MK-MG1500 meat grinder. The MK-MG1500 features a robust and powerful 1500W power to make short work of any meat and bones you throw at it.', 'Its durable stainless-steel cutting blades are tough enough to handle hard grinding on a regular basis. However, it would be wise to keep a spare grinding blade if you intend on doing so daily.', 'This electric meat grinder is not just powerful, but also easy to use and clean. Crafted from durable stainless steel including its metal gears, the grinder uses powerful motors to mince meats.', 'Have tough or big meats? There are three different grinding plates at 1.5mm, 2mm and 3mm for you to use. The wide loading tray is also useful, as you can cram more meat at one go.', 'For an all-purpose cooking tool, this 3-in1 hand mixer, blender and meat grinder is one to consider. It comes with all the necessary attachments to suit the task at hand. Because of its multi-functions, the see-through container allows you to check your meat or ingredient for the right consistency.', 'A 400W 2-speed motor powers the grinder. Together with its tough stainless-steel blades, you can make some pretty mean meat in no time. As a bonus, the attachments are all dishwasher safe for easy cleaning after use.', 'If you’ve got a pet cat that you’d rather feed raw food to such as fish and chicken, this manual hand-cranked meat grinder is for you. It’s quite a convenient grinder to have, as it’s easy to operate, store and clean.', 'To use, just put the meat into the hopper and turn the handle. Its stainless-steel blades ensure perfect minced food for your cat every time. The low cost also means you won’t have to spend a bomb just for your pet.', 'Pet dog is sick of dry food? Why not grind some raw meat with this durable manual meat grinder?', 'With stainless-steel blades and three different settings to suit the kind of meat for grinding, you can churn up a large batch of dog chow in no time at all. It’s super affordable, so you don’t have to fret about overspending on Fido.']"
11,https://productnation.co/my/home-appliance/small/6118/best-blender-brands-reviews-malaysia/,9 Blenders to Help Speed Up Your Dinner Prep,Haema,https://productnation.co/my/author/Haema/,2019-02-25 09:14:11,"['A must-have home appliance, the blender is certainly a versatile kitchen helper. It conveniently allows you to prepare any meal of your choice within minutes. Chop, process, blend, mix, puree and juice ingredients of your choice just the way you like it. Prepare varieties of dishes and beverages efficiently with the blender with this selection of the best blender brands in Malaysia.', 'Resilient and competent to handle heavy-duty performance, the Tefal Blender 1.75L Blend Force would complete your blending, mixing, or grinding in seconds. With the Tripl’Ax technology, 6 blades and 3 combined actions, your cooking will be efficiently completed in record time. Certainly, your trustworthy kitchen aid which ultimately reduces your effort.', 'It will only take you a few seconds to completely crush any vegetable or fruit into smooth blends with the Innofood Heavy Duty Blender. Combine frozen fruits, fresh greens with soy or milk to create healthy shakes. The high-quality stainless steel 2-tier blade is powerful enough to grind, blend and thoroughly mix any smoothie of your taste. This blender is equipped to handle high duty performance for continuous and large quantity usage.', 'More: Prepare Smoothies In a Jiffy With These 8 Handheld Blenders', 'The ideal Malaysian choice, the Philips Sambal Maker is the best option to safely blend chillies for your everyday meal preparation. With the 4-star blade technology, you can either blend fresh chilies to a wet ingredient or even mill the chilies for a dry ingredient. With the 2 speed and pulse system, you will be amazed to see fresh ‘sambal’ catered to your taste in seconds.', 'Philips Food Processor is a top-rated blender for preparing large portions of meals in mere seconds. It uses a powerful precision function with 2-speed settings and pulse control to chop, blend and emulsify fresh ingredients. This blender is also accessorized for perfect dough preparation, mixing cake batter and even fluffing egg whites. Your perfect kitchen helper indeed.', 'This blender by Sharp is great for those on-the-go, just blend and takeaway. The portable bottle allows you flexibility and convenience for those that want to bring their drink with them. This personal blender is not just for fruits, it can blend and break ice as well.', 'The best option for economical home usage, the Khind Blender Juice Extractor is a needed companion in the kitchen. A complete helper great for daily use with anti-slip footing, jar safety lock, stainless steel blades and 4-speed function. You can prepare pastes, sauces, and spice or grain blends without any difficulty. Suitable for your everyday lifestyle.', 'Bear QSJ-02R1 Food Processor features stainless steel, S-shaped, 4 high-level sharp blades to perfectly chop, mince and puree ingredients. With the one-touch operation system, you can mix salad ingredients, salsas, hummus dips and pesto dressings without any hassle. It is both multipurpose and easy to handle with the comfortable design, a suitable everyday blender for versatile food making.', 'Specifically catering for baby food preparation, the Baby Food Processor Blender Mixer is an innovative technology to assist parents. Specially designed to blend fruits and vegetables, you can prepare food according to your needs.', 'With options to finely grind and pulse, you can prepare pureed meals or easy-to-chew dishes for your babies and toddlers. It stays completely fresh with its sealed lid and is safe to store in your refrigerator or freezer.', 'Designed with your comfort in mind, the Breville BSB510 Hand Blender is equipped with sharp blades and an ergonomic handle. Instead of using excessive force, this hand blender allows you to purify and blend ingredients with minimal effort. From a simple concoction to gourmet soups, you can completely depend on Breville to assist you. It is dishwasher safe and the detachable parts are easy to clean.', 'More: 8 Personal Blenders You Can Make Your Favorite Smoothies With']"
