,Link,Title,Author,Author_Profile,Date_Time,Content
12,https://productnation.co/my/tech/computing/27725/best-speaker-malaysia/,The Top 10 Best Speakers To Own For All Music-Lovers,kayshni,https://productnation.co/my/author/kayshni/,2019-08-13 19:19:10,"['Whether you need it in the car, at home or on-the-go, there’s bound to be a speaker that gets the job done for you. However, the market is saturated with tons of choices so picking the right one can be a daunting task. ', 'We’ve listed below he best speakers in the market, ranging from Bluetooth to bookshelf varieties.', 'You can hype up the atmosphere at any beach or pool party with the ruggedly-designed JBL Flip 4. The durable fabric material that wraps around the speaker is not only waterproof; it also fends off dust, dirt, and sand. ', 'As far as sound quality is concerned, the Flip 4 is capable of producing sounds with powerful bass, crisp sounds at maxed-out volumes, and loud vocals in the mid-range.  The Flip 4 can even last up to a whopping 12 hours thanks to its 3000mAh rechargeable Li-ion battery.', 'The Logitech Z623 makes gaming on your PC much more immersive with its powerful 2.1 speaker system that has the ability to bring out 3D-esque sounds. This Logitech Z623 houses a convenient RCA and two 3.5 mm inputs so you can connect up to three audio devices at a time. ', 'Powered by an impressive 200W, the sounds remain clear and undistorted even when the volume is dialled up a notch. On top of that, get ready for some room-shaking rumbles courtesy of the 130-watt subwoofer’s ability to produce thunderous bass.', 'At an affordable price tag, the Alpine SPS-619 features some of the best audio quality in the market to play your favourite soundtracks on road trips. The Alpine SPS-619 excels at high-frequency ranges, producing impressive sounds that are loud and not shrill. As for the mids, the SPS-619 churns out music that sounds incredibly detailed and clear. ', 'On top of that, you can bop to the beat with the SPS-619’s ability to produce accurate bass tones. In addition, the dimensions of the speaker are suited to most cars so the installation process should be easy.', 'Skip the trip to your local karaoke box and sing your heart out at home with the Sony MHC-V71D. Besides streaming music from mobile devices via NFC and Bluetooth, the speaker features an input for USB flash drives, a DVD player and an HDMI output. If you fancy, duets are made possible with the two microphone inputs available for karaoke.', 'Unleash your inner rock star as the Sony MHC-V71D can even double as an amplifier when you plug in your guitar to one of the inputs. The speaker also has a 360° Party Light function to create a nightclub-like atmosphere. Above all, it has the ability to produce incredibly loud and clear sounds with bass reproduction that will make your bones rattle.', ""From full orchestral to rock 'n' roll, you can rest assure that the Q Acoustics 3020 speaker delivers refined yet dynamic sounds every time. Experience the bass drops in your favorite tunes like never before courtesy of its large diameter bass cone and huge cabinet volume."", 'With its precision laser-cut steel construction and white satin paint finish, the Q Acoustics 3000ST is a perfect aesthetic match for the Q Acoustics 3020 speakers. Besides, for more accurate sounds, the support columns are filled with acoustic wadding inserts to damp the entire stand and prevent them from ringing.', 'At a price tag that won’t bleed you dry, the Havit M13 is the king of connectivity with its support for Bluetooth Connection, a slot for Micro SD card and an input for AUX. If you are wondering, the Micro SD card slot supports MP3 format music. Otherwise, feel free to connect to its 3.5mm audio port with your music player/phone. ', 'With Bluetooth 4.0, you can skip the wires altogether and easily pair your device with the speaker wirelessly. Through its built-in 2000mAh rechargeable battery, you are getting your hands on an impressive 6 hours of playback time.', 'Be it land or water, the waterproof JBL Clip 2 is convenient to carry around with its impeccably lightweight and rugged design, as well as its nifty built-in carabiner. The Clip 2 can pair with any Android or iOS device so you can stream music wirelessly via Bluetooth 4.2. ', 'Don’t worry if your device does not support Bluetooth, the Clip 2 has an integrated 3.5mm audio cable that you can use to plug into your device. Plus, this speaker is host to a noise and echo-free speakerphone so you can take crisp and clear calls with just the touch of a button.', 'Take your show on the road without the hassle of wires courtesy of the all-in-one portable JBL EON208P PA system that features Bluetooth connectivity. Thanks to its 8-channel detachable mixer that features a professional I/O and intuitive controls, the JBL EON208P allows you to fine-tune sounds to cater to the specific venue. ', 'Powered by 300 watts, the twin 8″ speakers have the juice needed to produce sounds that are not just loud but clear as well. As the speakers feature a lightweight and comprehensive design, they are effortlessly portable to bring to anywhere.', 'Don’t let its tiny size fool you. The Sonos One offers powerful sounds that can carry even the most dynamically driven songs. Have your pick at your favourite voice assistant as the Sonos One provides support for both Alexa and Google Assistant. ', 'With the Sonos app and its integration of a plethora of streaming music services like Spotify and Google Play Music, control your music with just the sound of your voice. To top it off, the Sonos One also has the ability to blend in with the rest of the products in your smart home ecosystem.', 'The KEF LS50 Wireless Speakers are true active speakers with each of its drive units having a dedicated power amplifier to add extra oomph to your listening experience. These speakers generate sounds that are incredibly balanced tone-wise. Instrumental sounds are also layered harmoniously while vocals are delivered with passion. ', 'When it comes to the mids, it’s focused and clear, the bass is rich yet controlled, while the treble is impressively punchy. To top it off, the KEF LS50 is very flexible with regards to its connectivity options as there is an aux, optical and Type-B USB inputs, as well as a subwoofer out and an Ethernet port.']"
13,https://productnation.co/my/parenting/baby/20203/best-baby-bottle-malaysia/,11 Types of Baby Bottles for Stress-Free Easy Feeding,Violet Velu,https://productnation.co/my/author/Violet%20Velu/,2019-01-03 08:10:47,"['There is a steep learning curve for new parent responsibilities, and one of it is bottle- feeding a baby. With dozens of brands to choose from, it can be a daunting task to know exactly what kind of bottle is suitable.', 'That is why we have narrowed down the best baby bottles thanks to their practicability, god-send stellar design, smart innovation, and all-around user-friendliness.', 'No more nipple confusion from your baby. Comotomo Natural Feel Baby Bottle makes feeding simpler, giving breastfeeding moms more freedom without worrying about their little one getting insufficient milk and nutrients.', 'Comotomo’s wide, flexible and supple mound will ease your baby’s transition from breast to bottle, emulating a skin-to-skin nursing experience. Made as a leak-proof bottle, the body is also of the same soft medical-grade silicone as the bottle nipple, so your baby’s little hands can comfortably grip and hold onto it.', 'This bottle features a wide neck that’s designed for easy cleaning. As the bottle is free from BPA, phthalates and PVC, you can boil them without having to worry about harmful chemicals being released.', 'Prevent colic and relief your baby’s tummy discomfort with the Phillips AVENT Natural Range bottles, making feeding natural for both of you.', 'The bottle features a clinically-proven, anti-colic nipple that flexes to your baby’s feeding rhythm, which helps prevent trapped air in your baby’s tummy. Its unique valve on the extra-supple nipple makes it easy for your baby to latch on, as well as opening to release air into the bottle instead of being ingested by your baby.', 'Available in different sizes, this BPA-free bottle possesses a wide neck that eases cleaning and for easy assembling.', 'Dr. Brown’s Natural Flow bottles have an original vent system that vacuums air out of the bottle. This alleviates acid reflux, gas, colic and other irritable issues to a baby during feeding time.', 'Another amazing feature is how the bottle’s nipple venting creates a positive pressure flow to mimic natural breastfeeding movements. As air is vented out of the bottle, this maintains high levels of Vitamin A, E and C in the milk. Plus, as your baby’s feeding becomes more developed, there is always the convenient option of removing the vent.', 'TommeeTippee Essentials Easy-Grip Bottle is perfect for tiny hands! Its soft silicone body facilitates medium flow which lowers the risks of gas being ingested by your child. A BPA-free bottle, it is easy to fill and clean without any fuss.', 'The bottle also comes with a leak-proof hygiene cap for sealing the nipple, greatly easing your travels. No more worrying about messy spillage on your journey!', 'No more fumbling and measuring baby formula when you are on-the-go, as everything is clean, hygienic and ever-ready when needed with this mixer bottle. B.box Essential Baby Bottle lets you place the formula into the compartment that attaches to the bottom of the bottle. Then fill the bottle with water.', 'When it is feeding time, just press the release button to mix the drink, then shake the bottle and voila, a ready meal for your baby!', 'The bottle’s unique dual functionality allows it to be attached to a standard bottle by attaching the base cap to the bottom. However, its curved ergonomic bottle is recommended for use as it’s designed for better feeding. Free from BPA, phthalates and PVC, this bottle is dishwasher and sterilizer safe.', 'Parents will love this miracle, on-the-go feeding bottle. The Pigeon Slim Neck Weaning Bottle is convenient for one-handed feeding and comes with a leak-proof storage cap for spoon-sealing, making it ideal for travelling!', 'This soft-body bottle is also great for your baby’s first experience with a spoon, eliminating any fuss of scooping. Being able to hold up to 240 ml, you can ease the first stage of weaning with juice, soup or soft solids. With this, feeding in a car or plane is now easier without risking a mess afterwards.', 'Tinukim Hands Free Baby Bottle is a welcoming solution for today’s busy and on-the-go parents. The bottle is equipped with removable handles, essentially encouraging independent feeding. There is also a straw that runs through the bottle. Its nipple mimics that of a breast, allowing babies to comfortably switch to bottle feeding.', 'Featuring a double vent nipple, this keeps air out while promoting a comfortable feeding experience for your baby. The bottle adapts a unique flow system to allow your baby in managing the milk’s pace and flow. Designed to be leak-free, the bottle is clinically proven to reduce ear infections and other irritable issues that can cause discomfort to your baby.', 'Assist your baby in transitioning from a feeding bottle to a cup with this training bottle from Puku. This bottle has a food grade silicone nipple that is integrated with a flexible, anti-leakage straw to facilitate good air flow, thus preventing air ingesting which causes tummy discomfort.', 'Coming with a tight seal cover, this protects the nipple from any contact with foreign substances. The bottle is manufactured from premium glass that is both safe and heat resistant. Sporting an ergonomic design, it can fit into tiny hands while encouraging self-feeding.', 'Another special feature is the anti-dust cover for the nipple bottle. It is also decorated with a non-toxic print of a PUKU cartoon to amuse your baby.', 'When breastfeeding is not an option, Playtex Baby® Nurser with Drop-Ins is the best bottle alternative to achieve your feeding goals. Clinically proven and carefully designed, each aspect of this bottle system works to closely to mimic a mother’s feeding rhythm, ensuring the best, natural feeding experience.', 'Featuring a disposable, pre-sterilized soft liner, it gently collapses as a mother’s breast does while the baby feeds, preventing air from mixing into the milk and entering the baby’s tummy. This promotes air-free feeding to reduce colic.', 'Another reason to consider this bottle is its natural-latch nipple, which mimics the breast to ensure your baby can latch on and control the milk flow. This allows easy switching between breast and bottle.', 'Starting self-feeding can be a very exciting time for both you and your baby. Let Philips Avent Classic Plus Bottle be your little one’s first step to independence.', 'Having an easy-grip adjustable handle, the BPA-free bottle is made with an anti-colic air system which is integrated into the nipple. This helps prevent air ingestion, thus leaving your baby happy and full. With only 4 parts, it is also quick to assemble and easy to clean thoroughly.', 'The ThinkbabyThinkster Straw Bottle has an extra soft, medical grade silicon straw that eases your baby’s transition from a feeding bottle to a sippy cup. Its swivel top reduces chances of spillage while protecting the feeding straw from coming into contact with foreign substances.', 'The straw also features a cross-cut design to prevent zero leakage. To fit nicely into most cup holders, its easy-grip handles are designed to be removable. Since this bottle is free from BPA, phthalates, nitrosamines, lead PVC, PET and harmful biological harmful chemicals, parents do not have to worry about toxic chemicals leaking into the baby’s milk.']"
14,https://productnation.co/my/voucher-promo-coupon-codes-malaysia/22959/9-9-sales-malaysia/,Wanna Get Up to 99% Off Your Shopping? Here's How.,Karyn,https://productnation.co/my/author/karyn/,2019-01-22 08:29:18,"['', '', ""Approaching the end of the year means that we're heading into a period of sales, sales and more sales. And what's not to love about that? To kick things off, the 9.9 Online Shopping Day is definitely one that we are excited for. With discounts up to 99% in stored, we've gathered some of the best deals you'll find on this day. Check them out below!"", '', '', ""Back and better, this year's Shopee's 9.9 Super Shopping Day is set to be the largest ever with over 10,000 sellers, 120 brands, and 40 corporate partners on board."", 'From 27th August 2018 onwards, customers can enjoy special themed days every day leading up to the 9.9 Super Shopping Day. Flash deals, jaw-dropping discounts of up to 99% and lots of Shopee vouchers are also up for grabs throughout this period. Free shipping is also available!', 'Get on the Shopee app to participate in the Super Shopee Shake to also win lots of coins. For more information and to start shopping, visit shopee.com.my.', ""In conjunction with the 9.9 online shopping day on Shopee, we've searched the site for some of the best prices available. Check out our editors' top 5 tech picks under RM 30 below!"", '', '', 'BUY NOW', 'RM 30.00', 'This 10000mAh power bank has a unique built-in vibrating switch that you will have to shake to get it to start charging. This makes it easier to use. With the ability to automatically shut-off once your device is fully charged, it is also proven to be more reliable and safer. Furthermore, the built-in micro USB cable is highly compatible with most devices.', '', '', 'BUY NOW', 'RM 30.00', 'Easily charge all your devices and appliances with this power strip! With 3 anti-static AC sockets and 6 intelligent USB ports with the ability to automatically recognise USB peripherals and allocate current accordingly, it is truly multifunctional.', '', '', 'BUY NOW', 'From RM 24.90', ""This cordless mic comes with 2 high quality dual speakers, an in-built adjustable mixer and a USB port for easy charging or recording. It also features Bluetooth connectivity and is compatible with both iOS and Android smartphones. Highly functional yet simple to use, there's no wonder why this mic is all the rage these days!"", '', '', 'BUY NOW', 'RM 25.00', ""No need to skim on quality with JBL's C100SI headphones! With a frequency range of 20Hz to 20kHz, this headphone comes with 3 sizes of ear tips to fit most ears. It is also compatible with both iOS and Android devices."", '', '', 'BUY NOW', 'From RM 17.40', 'This microSD memory card is ideal for a wide range of devices that support SD memory card such as cameras, camcorders and laptops. It has excellent data transfer speeds, and even supports high-quality videos. Choose from a capacity of 16GB, 32GB, 64GB and 128GB. ', '', '', 'Buy 2 and get 25% off this 9.9 Super Shopping Day on Zalora! All orders also enjoy 30 days of free returns, a cash on delivery option and free delivery for orders over RM 75. Head over to zalora.com.my to start shopping!', '', '', ""Earn vouchers, take part in flash deals and enjoy lots of discounts on Lazada. With over 100 participating brands and discounts up to 90%, there won't be a better time to shop! Events are also taking place every day from 1st September 2018 onwards. For a detailed guide and to make sure you don't miss out on anything, visit lazada.com.my.""]"
15,https://productnation.co/my/eats/drinks/27516/best-cranberry-juice-malaysia/,These 8 Best Cranberry Juices Will Pump Your Body with Vitamins and Minerals,lirong,https://productnation.co/my/author/lirong/,2019-05-03 08:41:57,"[""Pure cranberry juice contains a wide array of vitamins, minerals, amino acids and beneficial lipids. There is a wide assortment of cranberry juice products in the market. Check out our list and choose the best one that'll suit your needs."", ""If you’re looking for a great mixer to go with your vodka, then this lightly carbonated cranberry beverage will hit the spot. It's processed to enhance your drink, giving it a refreshing and delicious taste. Additionally, it comes in a cute, pink Kanehei’s Piske and Usagi can."", 'This affordable product contains 20% of pure, concentrate cranberry and 2% of cranberry puree. Drinking a glass of The Berry Company’s Cranberry juice daily will help improve your metabolism, fortify your immune and digestive system. It also works to keep your kidneys healthy and will help get rid of any infections in the long run.', ""This 100% pure and organic cranberry juice from Lakewood is cold pressed to retain all the essential micronutrients. The juice is GMO-free with no added sugars, flavourings and preservatives. If you're looking to detox your body system, then one glass a day of this juice is all you need."", ""Eu Yan Sang’s Biotta Wild Mountain Cranberry is a unique formulation developed in Switzerland. It's made from pure wild mountain cranberries to combat bladder and urinary tract infections. These berries are higher in tannic acid and proanthocyanidins, compared to regular cranberries. Also, the recommended consumption of 100ml, three times daily will keep infections at bay."", ""Country Farms Organics Cranberry juice is made from freshly squeezed, organically grown Canadian cranberries. It utilises a patented cold press technique which preserves the essential goodness of the cranberries. There's no added colour, sugar or additives. Drinking this product daily will help maintain your health; keeping you young and energised."", 'This unsweetened cranberry juice from 21st Century is especially good for pregnant moms and people who have diabetes. With its low sugar content but high purity, a glass of this juice will help to avoid mucus build up in your bladder, flushing out and detoxing your system. Besides, it will help eliminate muscle cramps.', 'Drinking pure cranberry juice every day can prevent yeast infections. This premium product is made from 100% pure ripe North American cranberries that are pressed and bottled at Rabenhorst. There are only 4.8 grams of sugar per 100ml without any artificial flavourings.', 'Ocean Spray contains 27% pure and organic cranberry juice along with other extracts, sweeteners and flavourings to enhance its taste. This tasty beverage contains no wheat or high fructose corn syrup. It is ideal for making a killer cosmopolitan cocktail.']"
16,https://productnation.co/my/tech/computing/27649/best-electronics-to-buy-shopee-7-7-sale/,7 Electronics To Get Your Hands On During The Shopee 7.7 Orange Madness Sale,Karyn,https://productnation.co/my/author/karyn/,2019-06-25 08:15:50,"['There’s a sale in town and it’s not one to be missed!', ""We're seeing orange this season because Shopee’s 7.7. Orange Madness sale is truly all things mad personified. Running from 24th June - 7 July, it features high-valued products being sold at only RM0.77, mystery gifts priced at RM1, A LOT of Shopee coins and the all-new Shopee24 Express Delivery."", ' If you’re ready to start shopping, here’s in our opinion, the best deals to look out for!', 'CPU: Intel® Core™ i7 Processor | Graphics: UHD (3840 x 2160) IPS | Memory: 8 GB DDR4 (13"") / 16 GB DDR4  | Storage: 128GB PCIe SSD /256 GB PCIe SSD/512 GB PCIe SSD/1 TB PCIe SSD | Weight: 1.1kg (13"") / 1.55kg (14"")  ', 'Lightweight, slim, easily portable yet powerful - these are just some of the words to describe the Lenovo Ideapad 720s. Offering 7th generation Intel Core i7 processing, it sports performance abilities that will be able to keep up with your productivity levels. This laptop also delivers immersive audio and brilliant graphics, and comes with a fingerprint reader for swift yet convenient login. ', ""If you've not gotten an air fryer for your home, Tefal's Fry Delight FX1000 is a deal that you won't want passing you by. This fryer prepares crispy and tasty food using close to no oil to give you low-fat and healthier options. It also comes with grill, roast and bake features, adjustable temperature and parts that can be easily removed for thorough cleaning. "", ""With its DSP digital noise reduction, you can be assured that Redmi's Airdots will deliver the sound quality that you desire. It splits audio to both earbuds for a great wireless experience, and comes with a charging dock that offers 12 hours of battery life at full charge. "", ""Gaming on your phone has never been easier than with the Black Shark 2. This phone features the world's lowest latency touch and was ergonomically crafted to deliver extra grip and precise movements. Its sleek design makes it a pride to carry around, and a 5-minute charge is all you'll need to be able to game for another 30 minutes! Truly - by gamers, for gamers."", 'With several features to support a comfortable gaming experience, you can’t go wrong with the Black Shark 2. It features a great enhancement of the cooling system, a 6.39-inch AMOLED screen that’s almost bezel-less, as well as technology to enhance performance. Black Shark 2 will have you make most gamers green with envy.', ""Wired vacuum cleaners, move aside! This robotic one from Haier works to sweep, mop and even has a suction feature to vacuum your floor. It supports 90 minutes of non-stop cleaning and is smart enough to return to its charging dock on its own when it is low on battery. It also comes inbuilt with an advanced Detection Technology that will ensure it doesn't run into furnitures, obstacles or fall down stairs. "", ""This Panasonic grinder isn't a 2-in-1 product. Instead, it's a 6-in-1 product with the ability to blend, whip, dry grind, chop, wet grind and liquidize. A convenient cooking partner to have around, you can now whip up anything from tasty dishes to yummy baked goods with the help of this one device! "", ""The Realme 2 Pro is one of the rare phones that has an 8GB RAM for only slightly more than RM1000. Yet, the phone's affordability does not affect its performance, as this phone delivers just as other smartphones do. With 16MP (f/1.7) + 2MP (f/2.4) dual camera, it provides for pictures of excellent quality and even supports Face Unlocking. "", 'Excited yet? With payday just around the corner, we suggest you put aside some moolah for these babies. Also, be a smart shopper and use a Shopee promo code or two to save more on your shopping!']"
